,Islamic,,Islamic_History,,Personality,,Short Story,,Poetry,,Language,,Geography,,History,,Scientific,,Society,,Novel
Islami Muashra,1,Tarikh Islam,2,Haider Ali,1,Saro Ki Neki,1,,,,,,,Pakistan,1,Ejadat ki Kahaniya,1,Sab se Bada Insan,2,Courage and Endurance,1
Masnoon Duayen,1,Tajliyat-e-Nabwat,1,Quaid kahani,1,Tajal ki Kahani,1,,,,,,,Bharat,1,,,Pakistan se Iqbalistan Tak,1,Yalghar,1
Auraton ke imtiazi Masail,1,Balochistan mein Sahaba Karam,1,Hazrat Younas,1,,,,,,,,,Saeed Siyah America Mein,1,,,Gapshap,1,Karnama,1
Muhammad Ki Nafli Ibadat,2,,,Khulfa-e-Rashdeen,1,,,,,,,,,Pakistan Par Almi Dehshatgardo Ka hamla,1,,,Career Guide,1,Walidain,1
Sunehri Naqoosh,1,,,Hazrat Ayoub,1,,,,,,,,,Pakistan Quiz,1,,,,,,
Aaftab-e-Nabuwat ki Sunehri Shuayen,1,,,Seerat Rsool,1,,,,,,,,,,,,,,,,
Akhlaq-e-Nabwi,1,,,,,,,,,,,,,,,,,,,,
